<!ELEMENT library (book+)>
<!ELEMENT book (title, author+, year, publisher)>
<!ATTLIST book
    bookcode ID #REQUIRED
>
<!ELEMENT title (#PCDATA)>
<!ELEMENT author (#PCDATA)>
<!ELEMENT year (#PCDATA)>
<!ELEMENT publisher (#PCDATA)>
